{
  "version": "0.1.0",
  "dataPackId": "ironhell-rewrite-core",
  "generatedAt": "2026-07-03T00:00:00Z",
  "files": [
    { "id": "terrain_features", "path": "data/rewrite/terrain_features.json", "schemaPath": "data/rewrite/schemas/terrain_features.schema.json", "version": "0.1.0", "checksum": "TBD" },
    { "id": "vault_templates", "path": "data/rewrite/vault_templates.json", "schemaPath": "data/rewrite/schemas/vault_templates.schema.json", "version": "0.1.0", "checksum": "TBD" },
    { "id": "shop_owners", "path": "data/rewrite/shop_owners.json", "schemaPath": "data/rewrite/schemas/shop_owners.schema.json", "version": "0.1.0", "checksum": "TBD" },
    { "id": "shop_rules", "path": "data/rewrite/shop_rules.json", "schemaPath": "data/rewrite/schemas/shop_rules.schema.json", "version": "0.1.0", "checksum": "TBD" },
    { "id": "shop_race_price_adjustments", "path": "data/rewrite/shop_race_price_adjustments.json", "schemaPath": "data/rewrite/schemas/shop_race_price_adjustments.schema.json", "version": "0.1.0", "checksum": "TBD" },
    { "id": "character_history_charts", "path": "data/rewrite/character_history_charts.json", "schemaPath": "data/rewrite/schemas/character_history_charts.schema.json", "version": "0.1.0", "checksum": "TBD" },
    { "id": "spell_books", "path": "data/rewrite/spell_books.json", "schemaPath": "data/rewrite/schemas/spell_books.schema.json", "version": "0.1.0", "checksum": "TBD" },
    { "id": "spell_progression_by_class", "path": "data/rewrite/spell_progression_by_class.json", "schemaPath": "data/rewrite/schemas/spell_progression_by_class.schema.json", "version": "0.1.0", "checksum": "TBD" },
    { "id": "spell_metadata", "path": "data/rewrite/spell_metadata.json", "schemaPath": "data/rewrite/schemas/spell_metadata.schema.json", "version": "0.1.0", "checksum": "TBD" },
    { "id": "dungeon_generation_rules", "path": "data/rewrite/dungeon_generation_rules.json", "schemaPath": "data/rewrite/schemas/dungeon_generation_rules.schema.json", "version": "0.1.0", "checksum": "TBD" },
    { "id": "wilderness_terrain_rules", "path": "data/rewrite/wilderness_terrain_rules.json", "schemaPath": "data/rewrite/schemas/wilderness_terrain_rules.schema.json", "version": "0.1.0", "checksum": "TBD" },
    { "id": "wilderness_hotspots", "path": "data/rewrite/wilderness_hotspots.json", "schemaPath": "data/rewrite/schemas/wilderness_hotspots.schema.json", "version": "0.1.0", "checksum": "TBD" },
    { "id": "simulation_limits", "path": "data/rewrite/simulation_limits.json", "schemaPath": "data/rewrite/schemas/simulation_limits.schema.json", "version": "0.1.0", "checksum": "TBD" },
    { "id": "social_actions", "path": "data/rewrite/social_actions.json", "schemaPath": "data/rewrite/schemas/social_actions.schema.json", "version": "0.1.0", "checksum": "TBD" },
    { "id": "economy_rules", "path": "data/rewrite/economy_rules.json", "schemaPath": "data/rewrite/schemas/economy_rules.schema.json", "version": "0.1.0", "checksum": "TBD" },
    { "id": "balance_targets", "path": "data/rewrite/balance_targets.json", "schemaPath": "data/rewrite/schemas/balance_targets.schema.json", "version": "0.1.0", "checksum": "TBD" },
    { "id": "monster_ai_profiles", "path": "data/rewrite/monster_ai_profiles.json", "schemaPath": "data/rewrite/schemas/monster_ai_profiles.schema.json", "version": "0.1.0", "checksum": "TBD" },
    { "id": "content_migrations", "path": "data/rewrite/content_migrations.json", "schemaPath": "data/rewrite/schemas/content_migrations.schema.json", "version": "0.1.0", "checksum": "TBD" },
    { "id": "savegame_schema", "path": "data/rewrite/savegame_schema.json", "schemaPath": "data/rewrite/schemas/savegame_schema.schema.json", "version": "0.1.0", "checksum": "TBD" },
    { "id": "content_text_en", "path": "data/rewrite/i18n/en/content_text.json", "schemaPath": "data/rewrite/schemas/content_text.schema.json", "version": "0.1.0", "checksum": "TBD" },
    { "id": "network_messages", "path": "data/rewrite/network_messages.json", "schemaPath": "data/rewrite/schemas/network_messages.schema.json", "version": "0.1.0", "checksum": "TBD" },
    { "id": "savegame_compatibility_matrix", "path": "data/rewrite/savegame_compatibility_matrix.json", "schemaPath": "data/rewrite/schemas/savegame_compatibility_matrix.schema.json", "version": "0.1.0", "checksum": "TBD" }
  ]
}